Actualizació diària;04/05/2021
Total acumulat de casos confirmats des de l'inici (31-01-2020) / Total acumulado de casos confirmados desde el inicio (31-01-2020); 402569
Total acumulat de PCR+ des de l'inici (31-01-2020) / Total acumulado de PCR+ desde el inicio (31-01-2020); 391100
Total casos confirmats hospitalitzats (incloent UCI) en el dia/ Total casos confirmados hospitalizados (incluyendo UCI) en el dia; 219
Total casos confirmats hospitatlitzats en UCI en el día / Total casos confirmados hospitalizados en UCI en el día; 54
Total acumulat de casos confirmats d'alta epidemiològica des de l'inici (31-01-2020) / Total acumulado de casos confirmados dados de alta epidemiológica desde el inicio (31-01-2020); 392065
Total acumulat de casos confirmats morts des de l'inici (31-01-2020) / Total acumulado de casos confirmados fallecidos desde el inicio (31-01-2020); 7354
